{
  "$schema": "https://json-schema.org/draft/2020-12/schema",
  "$id": "https://raw.githubusercontent.com/claricle/lens_core/main/schemas/lens-diagnostics-v1.json",
  "title": "LensCore diagnostics report, schema version 1",
  "description": "Normative wire format. Unknown object members are permitted everywhere (additive evolution) except inside `summary`, where they are ignored. See docs/diagnostics-v1.adoc for the rules JSON Schema cannot express.",
  "type": "object",
  "required": ["schema_version", "producer", "profile", "valid", "summary", "diagnostics"],
  "properties": {
    "schema_version": { "const": 1 },
    "producer": { "$ref": "#/$defs/producer" },
    "profile": { "$ref": "#/$defs/profile" },
    "timestamp": { "$ref": "#/$defs/timestamp" },
    "valid": { "type": "boolean" },
    "summary": { "$ref": "#/$defs/summary" },
    "diagnostics": {
      "type": "array",
      "items": { "$ref": "#/$defs/diagnostic" }
    }
  },
  "if": { "properties": { "valid": { "const": true } }, "required": ["valid"] },
  "then": { "properties": { "summary": { "properties": { "errors": { "const": 0 } } } } },
  "$defs": {
    "text": { "type": "string", "minLength": 1 },
    "count": { "type": "integer", "minimum": 0 },
    "timestamp": {
      "type": "string",
      "format": "date-time",
      "pattern": "^\\d{4}-\\d{2}-\\d{2}T\\d{2}:\\d{2}:\\d{2}(\\.\\d+)?(Z|[+-]\\d{2}:\\d{2})$"
    },
    "producer": {
      "type": "object",
      "required": ["name", "version"],
      "properties": {
        "name": { "$ref": "#/$defs/text" },
        "version": { "$ref": "#/$defs/text" }
      }
    },
    "profile": {
      "type": "object",
      "required": ["id", "citations"],
      "properties": {
        "id": { "$ref": "#/$defs/text" },
        "citations": { "$ref": "#/$defs/citations" }
      }
    },
    "summary": {
      "type": "object",
      "required": ["errors", "warnings", "infos"],
      "properties": {
        "errors": { "$ref": "#/$defs/count" },
        "warnings": { "$ref": "#/$defs/count" },
        "infos": { "$ref": "#/$defs/count" }
      }
    },
    "citations": {
      "type": "array",
      "items": { "$ref": "#/$defs/citation" }
    },
    "citation": {
      "type": "object",
      "required": ["uri"],
      "properties": {
        "uri": { "type": "string", "pattern": "^[A-Za-z][A-Za-z0-9+.-]*:\\S+$" },
        "label": { "$ref": "#/$defs/text" }
      }
    },
    "diagnostic": {
      "type": "object",
      "required": ["severity", "kind", "requirement_id", "message"],
      "properties": {
        "severity": { "enum": ["error", "warning", "info"] },
        "kind": { "$ref": "#/$defs/text" },
        "requirement_id": { "$ref": "#/$defs/text" },
        "message": { "$ref": "#/$defs/text" },
        "citations": { "$ref": "#/$defs/citations" },
        "remediation": { "$ref": "#/$defs/text" },
        "context": { "type": "object" },
        "location": { "$ref": "#/$defs/location" }
      }
    },
    "location": {
      "type": "object",
      "required": ["type"],
      "properties": {
        "type": { "enum": ["xml", "binary"] }
      },
      "allOf": [
        {
          "if": { "properties": { "type": { "const": "xml" } }, "required": ["type"] },
          "then": {
            "properties": {
              "line": { "type": "integer", "minimum": 1 },
              "column": { "type": "integer", "minimum": 1 },
              "path": { "$ref": "#/$defs/text" },
              "byte_offset": false,
              "byte_length": false,
              "record_index": false,
              "record_type": false
            }
          }
        },
        {
          "if": { "properties": { "type": { "const": "binary" } }, "required": ["type"] },
          "then": {
            "properties": {
              "byte_offset": { "type": "integer", "minimum": 0 },
              "byte_length": { "type": "integer", "minimum": 0 },
              "record_index": { "type": "integer", "minimum": 0 },
              "record_type": { "$ref": "#/$defs/text" },
              "line": false,
              "column": false,
              "path": false
            }
          }
        }
      ]
    }
  }
}
